{
  "experiment_id": "ATTR-EXAMPLE-TRAJECTORY-001",
  "source_packet_hash": "a29d394c61cfc360b48a0e35e3e81c649cbb30b261e12e0dacc981a814464748",
  "prompt_hash": "12b6f822810e6c8f49e08dbf45f4839961377056f320f4fd292d6bb1d95f58bb",
  "trajectory_packet_hash": "a5facfa35c9017e02d797902800370d329990b59829d979c45e220fb729fa587",
  "thresholds": {
    "minimum_observations_per_condition": 2,
    "minimum_evaluator_agreement": 0.7,
    "maximum_contamination_risk": 0.2,
    "trajectory_effect_threshold": 0.2,
    "interchangeability_floor": 0.75
  },
  "observations": [
    {"observation_id":"ATTR-EXAMPLE-OBS-01","participant_id":"ATTR-EXAMPLE-P-01","evaluator_id":"ATTR-EVAL-1","condition":"same_access_no_trajectory","model_id":"controlled-model-v1","environment_id":"controlled-example-environment-v1","scores":{"problem_recognition_fidelity":0.42,"governing_distinction_fidelity":0.42,"dependency_reconstruction":0.42,"rejected_alternative_reconstruction":0.42,"authority_boundary_fidelity":0.42,"final_structure_similarity":0.42},"evaluator_agreement":0.9,"contamination_risk":0.05},
    {"observation_id":"ATTR-EXAMPLE-OBS-02","participant_id":"ATTR-EXAMPLE-P-02","evaluator_id":"ATTR-EVAL-2","condition":"same_access_no_trajectory","model_id":"controlled-model-v1","environment_id":"controlled-example-environment-v1","scores":{"problem_recognition_fidelity":0.42,"governing_distinction_fidelity":0.42,"dependency_reconstruction":0.42,"rejected_alternative_reconstruction":0.42,"authority_boundary_fidelity":0.42,"final_structure_similarity":0.42},"evaluator_agreement":0.9,"contamination_risk":0.05},
    {"observation_id":"ATTR-EXAMPLE-OBS-03","participant_id":"ATTR-EXAMPLE-P-03","evaluator_id":"ATTR-EVAL-1","condition":"partial_trajectory","model_id":"controlled-model-v1","environment_id":"controlled-example-environment-v1","scores":{"problem_recognition_fidelity":0.64,"governing_distinction_fidelity":0.64,"dependency_reconstruction":0.64,"rejected_alternative_reconstruction":0.64,"authority_boundary_fidelity":0.64,"final_structure_similarity":0.64},"evaluator_agreement":0.9,"contamination_risk":0.05},
    {"observation_id":"ATTR-EXAMPLE-OBS-04","participant_id":"ATTR-EXAMPLE-P-04","evaluator_id":"ATTR-EVAL-2","condition":"partial_trajectory","model_id":"controlled-model-v1","environment_id":"controlled-example-environment-v1","scores":{"problem_recognition_fidelity":0.64,"governing_distinction_fidelity":0.64,"dependency_reconstruction":0.64,"rejected_alternative_reconstruction":0.64,"authority_boundary_fidelity":0.64,"final_structure_similarity":0.64},"evaluator_agreement":0.9,"contamination_risk":0.05},
    {"observation_id":"ATTR-EXAMPLE-OBS-05","participant_id":"ATTR-EXAMPLE-P-05","evaluator_id":"ATTR-EVAL-1","condition":"full_trajectory","model_id":"controlled-model-v1","environment_id":"controlled-example-environment-v1","scores":{"problem_recognition_fidelity":0.86,"governing_distinction_fidelity":0.86,"dependency_reconstruction":0.86,"rejected_alternative_reconstruction":0.86,"authority_boundary_fidelity":0.86,"final_structure_similarity":0.86},"evaluator_agreement":0.9,"contamination_risk":0.05},
    {"observation_id":"ATTR-EXAMPLE-OBS-06","participant_id":"ATTR-EXAMPLE-P-06","evaluator_id":"ATTR-EVAL-2","condition":"full_trajectory","model_id":"controlled-model-v1","environment_id":"controlled-example-environment-v1","scores":{"problem_recognition_fidelity":0.86,"governing_distinction_fidelity":0.86,"dependency_reconstruction":0.86,"rejected_alternative_reconstruction":0.86,"authority_boundary_fidelity":0.86,"final_structure_similarity":0.86},"evaluator_agreement":0.9,"contamination_risk":0.05},
    {"observation_id":"ATTR-EXAMPLE-OBS-07","participant_id":"ATTR-EXAMPLE-P-07","evaluator_id":"ATTR-EVAL-1","condition":"human_only_control","model_id":"none","environment_id":"controlled-example-environment-v1","scores":{"problem_recognition_fidelity":0.45,"governing_distinction_fidelity":0.45,"dependency_reconstruction":0.45,"rejected_alternative_reconstruction":0.45,"authority_boundary_fidelity":0.45,"final_structure_similarity":0.45},"evaluator_agreement":0.9,"contamination_risk":0.05},
    {"observation_id":"ATTR-EXAMPLE-OBS-08","participant_id":"ATTR-EXAMPLE-P-08","evaluator_id":"ATTR-EVAL-2","condition":"human_only_control","model_id":"none","environment_id":"controlled-example-environment-v1","scores":{"problem_recognition_fidelity":0.45,"governing_distinction_fidelity":0.45,"dependency_reconstruction":0.45,"rejected_alternative_reconstruction":0.45,"authority_boundary_fidelity":0.45,"final_structure_similarity":0.45},"evaluator_agreement":0.9,"contamination_risk":0.05},
    {"observation_id":"ATTR-EXAMPLE-OBS-09","participant_id":"ATTR-EXAMPLE-P-09","evaluator_id":"ATTR-EVAL-1","condition":"shared_source_control","model_id":"controlled-model-v1","environment_id":"controlled-example-environment-v1","scores":{"problem_recognition_fidelity":0.4,"governing_distinction_fidelity":0.4,"dependency_reconstruction":0.4,"rejected_alternative_reconstruction":0.4,"authority_boundary_fidelity":0.4,"final_structure_similarity":0.4},"evaluator_agreement":0.9,"contamination_risk":0.05},
    {"observation_id":"ATTR-EXAMPLE-OBS-10","participant_id":"ATTR-EXAMPLE-P-10","evaluator_id":"ATTR-EVAL-2","condition":"shared_source_control","model_id":"controlled-model-v1","environment_id":"controlled-example-environment-v1","scores":{"problem_recognition_fidelity":0.4,"governing_distinction_fidelity":0.4,"dependency_reconstruction":0.4,"rejected_alternative_reconstruction":0.4,"authority_boundary_fidelity":0.4,"final_structure_similarity":0.4},"evaluator_agreement":0.9,"contamination_risk":0.05}
  ],
  "claimed_outcome": "supports_trajectory_dependence"
}
